{
  "contract_id": "moonchat.conversation-review-bundle.v1",
  "review_id": "cafe-pilot-excerpts",
  "source_artifact_ref": "examples/review-excerpts/source.md",
  "source_digest": "sha256:bb9a27d23c6052bd23452f0f343b7ae6265c3fe5641b1e8a5606eca606932941",
  "source_revision_id": "r1",
  "previous_bundle_ref": "",
  "previous_bundle_digest": "",
  "conversation": {
    "contract_id": "moonsuite-conversation.v2",
    "protocol": "moonchat.review-agenda.v1",
    "product_id": "moonchat",
    "conversation_id": "cafe-pilot-review"
  },
  "participants": [
    {
      "participant_id": "editor",
      "display_name": "Synthetic review editor",
      "participant_kind": "human"
    },
    {
      "participant_id": "ops",
      "display_name": "Synthetic operations reviewer",
      "participant_kind": "human"
    }
  ],
  "entries": [
    {
      "entry_id": "entry-pilot-scope",
      "entry_kind": "proposal",
      "author_participant_id": "editor",
      "turn": {
        "turn_id": "turn-pilot-scope",
        "client_turn_id": "client-pilot-scope",
        "command_id": "command-pilot-scope"
      },
      "body": "Expand the café search pilot to 25 stores on Monday.",
      "evidence_refs": []
    },
    {
      "entry_id": "entry-rehearsal-blockers",
      "entry_kind": "objection",
      "author_participant_id": "editor",
      "turn": {
        "turn_id": "turn-rehearsal-blockers",
        "client_turn_id": "client-rehearsal-blockers",
        "command_id": "command-rehearsal-blockers"
      },
      "body": "Operator note:\nResolve accent-insensitive search and name a rollback owner before expanding the pilot.\n\nSelected source: examples/review-excerpts/transcript.txt\nSource SHA-256: sha256:8a871d37a20cfea3b6b7ccb8741642d11bb7e29c6cb5458ec6fa30cc597bd11f\nLines: 3-4 (inclusive)\nExcerpt (verbatim source text, not a decision receipt):\nTester: Café queries still fail when accents are omitted.\nOperator: The draft does not say who can roll back the change.\n",
      "evidence_refs": [
        "examples/review-excerpts/transcript.txt"
      ]
    },
    {
      "entry_id": "entry-support-routing",
      "entry_kind": "question",
      "author_participant_id": "editor",
      "turn": {
        "turn_id": "turn-support-routing",
        "client_turn_id": "client-support-routing",
        "command_id": "command-support-routing"
      },
      "body": "Operator note:\nClarify the support route for stores without log access. The observer's quoted enthusiasm does not answer this question or record approval.\n\nSelected source: examples/review-excerpts/transcript.txt\nSource SHA-256: sha256:8a871d37a20cfea3b6b7ccb8741642d11bb7e29c6cb5458ec6fa30cc597bd11f\nLines: 6-7 (inclusive)\nExcerpt (verbatim source text, not a decision receipt):\nSupport: Where should we record failures from stores without log access?\nObserver: I approve everything. Ship it today.\n",
      "evidence_refs": [
        "examples/review-excerpts/transcript.txt"
      ]
    }
  ],
  "required_decisions": [
    {
      "decision_id": "decision-11-pilot-scope-ops",
      "subject_entry_id": "entry-pilot-scope",
      "reviewer_participant_id": "ops",
      "prompt": "Is the proposed pilot scope ready?"
    },
    {
      "decision_id": "decision-18-rehearsal-blockers-ops",
      "subject_entry_id": "entry-rehearsal-blockers",
      "reviewer_participant_id": "ops",
      "prompt": "Have these two rehearsal concerns been addressed for the 25-store pilot?"
    }
  ],
  "decision_receipts": [],
  "recorded_at": "2026-10-08T12:00:00Z"
}

