{
  "contract_id": "moonchat.conversation-review-bundle.v1",
  "review_id": "release-review",
  "source_artifact_ref": "examples/review-revision/new-source.md",
  "source_digest": "sha256:6ddf59606c3f52ab003eb8f7ef98789bf6b64b07aa64544c4f1b3210b726a31a",
  "source_revision_id": "revision-2",
  "previous_bundle_ref": "examples/review-revision/received-review.json",
  "previous_bundle_digest": "sha256:355eb4c8264acc8672b3278d3fad86eb9e18e7d7ac9b6a3e8e485007831a664b",
  "conversation": {
    "contract_id": "moonsuite-conversation.v2",
    "protocol": "moontown.collaboration-review.v1",
    "product_id": "moontown",
    "conversation_id": "release-room"
  },
  "participants": [
    {
      "participant_id": "fixture-agent",
      "display_name": "Fixture collaborator",
      "participant_kind": "agent"
    },
    {
      "participant_id": "fixture-human",
      "display_name": "Fixture reviewer",
      "participant_kind": "human"
    },
    {
      "participant_id": "fixture-ops",
      "display_name": "Fixture operations",
      "participant_kind": "human"
    }
  ],
  "entries": [
    {
      "entry_id": "release-proposal",
      "entry_kind": "objection",
      "author_participant_id": "fixture-agent",
      "turn": {
        "turn_id": "turn-1",
        "client_turn_id": "client-1",
        "command_id": "command-1"
      },
      "body": "The café search rollout now names Fixture operations as rollback owner. 🌙\nConfirm that the revised source addresses the original objection.",
      "evidence_refs": [
        "evidence/unicode-test.txt"
      ]
    },
    {
      "entry_id": "host-followup-17",
      "entry_kind": "question",
      "author_participant_id": "fixture-agent",
      "turn": {
        "turn_id": "host-turn-29",
        "client_turn_id": "desktop-draft-11",
        "command_id": "host-command-8"
      },
      "body": "Who checks café search after reloading the revised source?",
      "evidence_refs": []
    }
  ],
  "required_decisions": [
    {
      "decision_id": "release-decision",
      "subject_entry_id": "release-proposal",
      "reviewer_participant_id": "fixture-human",
      "prompt": "Does revision 2 address the rollback objection?"
    },
    {
      "decision_id": "host-ops-check-4",
      "subject_entry_id": "host-followup-17",
      "reviewer_participant_id": "fixture-ops",
      "prompt": "Can the named operations reviewer confirm the reload check?"
    }
  ],
  "decision_receipts": [],
  "recorded_at": "2026-10-09T15:00:00Z"
}

