{
  "contract_id": "moonchat.conversation-review-bundle.v1",
  "review_id": "github-pilot",
  "source_artifact_ref": "examples/review-github-refresh/source.md",
  "source_digest": "sha256:6a9cbc64f1f671f67f16172130839c0ae18025440e100abf0186448c287f5a5a",
  "source_revision_id": "r1",
  "previous_bundle_ref": "",
  "previous_bundle_digest": "",
  "conversation": {
    "contract_id": "moonsuite-conversation.v2",
    "protocol": "moonchat.review-agenda.v1",
    "product_id": "moonchat",
    "conversation_id": "github-pilot-room"
  },
  "participants": [
    {
      "participant_id": "assistant",
      "display_name": "Fixture assistant",
      "participant_kind": "agent"
    },
    {
      "participant_id": "editor",
      "display_name": "Fixture editor",
      "participant_kind": "human"
    },
    {
      "participant_id": "ops",
      "display_name": "Fixture operations lead",
      "participant_kind": "human"
    }
  ],
  "entries": [
    {
      "entry_id": "entry-github-fallback",
      "entry_kind": "objection",
      "author_participant_id": "editor",
      "turn": {
        "turn_id": "turn-github-fallback",
        "client_turn_id": "client-github-fallback",
        "command_id": "command-github-fallback"
      },
      "body": "Operator note:\nResolve the fallback concern raised on the code change.\n\nImported GitHub review thread (local snapshot, not a decision receipt)\nExport: examples/review-github-refresh/new-comments.json\nExport SHA-256: sha256:ffd7b3e0b07473805dcc350f2be79549c271d89863361c04af20ae0952595518\nThread root: 9007199254740993\n\nComment 9007199254740993\nGitHub login: \"fixture-editor\"\nMapped participant: \"editor\"\nContext: {\n  \"html_url\": \"https://github.com/example/synthetic/pull/7#discussion_r9007199254740993\",\n  \"pull_request_url\": \"https://api.github.com/repos/example/synthetic/pulls/7\",\n  \"path\": \"src/search/café.mbt\",\n  \"diff_hunk\": \"@@ -18,2 +18,2 @@\\n-return fallback(query)\\n+return indexed(query)\",\n  \"commit_id\": \"2222222222222222222222222222222222222222\",\n  \"original_commit_id\": \"1111111111111111111111111111111111111111\",\n  \"created_at\": \"2026-10-10T00:01:00Z\",\n  \"updated_at\": \"2026-10-10T02:00:00Z\",\n  \"id\": 9007199254740993,\n  \"line\": 20,\n  \"original_line\": 20,\n  \"start_line\": 18,\n  \"original_start_line\": 18,\n  \"position\": 3,\n  \"original_position\": 3,\n  \"pull_request_review_id\": 42,\n  \"side\": \"RIGHT\",\n  \"start_side\": \"RIGHT\"\n}\nBody (verbatim):\nCould the café lookup retain its fallback and name its on-call owner?\r\nThe recovery path still needs a rehearsal.\n\nComment 9007199254740994\nGitHub login: \"fixture-ops\"\nMapped participant: \"ops\"\nContext: {\n  \"html_url\": \"https://github.com/example/synthetic/pull/7#discussion_r9007199254740994\",\n  \"pull_request_url\": \"https://api.github.com/repos/example/synthetic/pulls/7\",\n  \"path\": \"src/search/café.mbt\",\n  \"diff_hunk\": \"@@ -18,2 +18,2 @@\\n-return fallback(query)\\n+return indexed(query)\",\n  \"commit_id\": \"2222222222222222222222222222222222222222\",\n  \"original_commit_id\": \"1111111111111111111111111111111111111111\",\n  \"created_at\": \"2026-10-10T00:02:00Z\",\n  \"updated_at\": \"2026-10-10T00:02:00Z\",\n  \"id\": 9007199254740994,\n  \"in_reply_to_id\": 9007199254740993,\n  \"line\": 20,\n  \"original_line\": 20,\n  \"start_line\": 18,\n  \"original_start_line\": 18,\n  \"position\": 3,\n  \"original_position\": 3,\n  \"pull_request_review_id\": 42,\n  \"side\": \"RIGHT\",\n  \"start_side\": \"RIGHT\"\n}\nBody (verbatim):\nCan we add a synthetic failed-query test?\n```diff\n+assert fallback(query)\n```\n\nComment 9007199254740995\nGitHub login: \"fixture-ops\"\nMapped participant: \"ops\"\nContext: {\n  \"html_url\": \"https://github.com/example/synthetic/pull/7#discussion_r9007199254740995\",\n  \"pull_request_url\": \"https://api.github.com/repos/example/synthetic/pulls/7\",\n  \"path\": \"src/search/café.mbt\",\n  \"diff_hunk\": \"@@ -18,2 +18,2 @@\\n-return fallback(query)\\n+return indexed(query)\",\n  \"commit_id\": \"2222222222222222222222222222222222222222\",\n  \"original_commit_id\": \"1111111111111111111111111111111111111111\",\n  \"created_at\": \"2026-10-10T00:03:00Z\",\n  \"updated_at\": \"2026-10-10T00:03:00Z\",\n  \"id\": 9007199254740995,\n  \"in_reply_to_id\": 9007199254740993,\n  \"line\": 20,\n  \"original_line\": 20,\n  \"start_line\": 18,\n  \"original_start_line\": 18,\n  \"position\": 3,\n  \"original_position\": 3,\n  \"pull_request_review_id\": 42,\n  \"side\": \"RIGHT\",\n  \"start_side\": \"RIGHT\"\n}\nBody (verbatim):\nI approve the wording, but the fallback still needs a rehearsal.\nThis comment is not a MoonChat decision.\n\nComment 9007199254740996\nGitHub login: \"fixture-ops\"\nMapped participant: \"ops\"\nContext: {\n  \"html_url\": \"https://github.com/example/synthetic/pull/7#discussion_r9007199254740996\",\n  \"pull_request_url\": \"https://api.github.com/repos/example/synthetic/pulls/7\",\n  \"path\": \"src/search/café.mbt\",\n  \"diff_hunk\": \"@@ -18,2 +18,2 @@\\n-return fallback(query)\\n+return indexed(query)\",\n  \"commit_id\": \"2222222222222222222222222222222222222222\",\n  \"original_commit_id\": \"1111111111111111111111111111111111111111\",\n  \"created_at\": \"2026-10-10T02:01:00Z\",\n  \"updated_at\": \"2026-10-10T02:01:00Z\",\n  \"id\": 9007199254740996,\n  \"in_reply_to_id\": 9007199254740993,\n  \"line\": 20,\n  \"original_line\": 20,\n  \"start_line\": 18,\n  \"original_start_line\": 18,\n  \"position\": 3,\n  \"original_position\": 3,\n  \"pull_request_review_id\": 42,\n  \"side\": \"RIGHT\",\n  \"start_side\": \"RIGHT\"\n}\nBody (verbatim):\nFollow-up: include 夜間 support in the rehearsal checklist.\n",
      "evidence_refs": [
        "examples/review-github-refresh/new-comments.json"
      ]
    },
    {
      "entry_id": "entry-launch",
      "entry_kind": "proposal",
      "author_participant_id": "assistant",
      "turn": {
        "turn_id": "turn-launch",
        "client_turn_id": "client-launch",
        "command_id": "command-launch"
      },
      "body": "Ship the café fix after the offline rehearsal; retain the pilot scope.",
      "evidence_refs": []
    },
    {
      "entry_id": "entry-github-report",
      "entry_kind": "question",
      "author_participant_id": "editor",
      "turn": {
        "turn_id": "turn-github-report",
        "client_turn_id": "client-github-report",
        "command_id": "command-github-report"
      },
      "body": "Operator note:\nCarry the reporting question into the pilot discussion.\n\nImported GitHub review thread (local snapshot, not a decision receipt)\nExport: examples/review-github-refresh/new-comments.json\nExport SHA-256: sha256:ffd7b3e0b07473805dcc350f2be79549c271d89863361c04af20ae0952595518\nThread root: 101\n\nComment 101\nGitHub login: \"fixture-editor\"\nMapped participant: \"editor\"\nContext: {\n  \"html_url\": \"https://github.com/example/synthetic/pull/7#discussion_r101\",\n  \"pull_request_url\": \"https://api.github.com/repos/example/synthetic/pulls/7\",\n  \"path\": \"src/search/café.mbt\",\n  \"diff_hunk\": \"@@ -18,2 +18,2 @@\\n-return fallback(query)\\n+return indexed(query)\",\n  \"commit_id\": \"2222222222222222222222222222222222222222\",\n  \"original_commit_id\": \"1111111111111111111111111111111111111111\",\n  \"created_at\": \"2026-10-10T00:04:00Z\",\n  \"updated_at\": \"2026-10-10T00:04:00Z\",\n  \"id\": 101,\n  \"line\": 20,\n  \"original_line\": 20,\n  \"start_line\": 18,\n  \"original_start_line\": 18,\n  \"position\": 3,\n  \"original_position\": 3,\n  \"pull_request_review_id\": 42,\n  \"side\": \"RIGHT\",\n  \"start_side\": \"RIGHT\"\n}\nBody (verbatim):\nWhere should the pilot error report be stored?\n",
      "evidence_refs": [
        "examples/review-github-refresh/new-comments.json"
      ]
    }
  ],
  "required_decisions": [
    {
      "decision_id": "decision-15-github-fallback-ops",
      "subject_entry_id": "entry-github-fallback",
      "reviewer_participant_id": "ops",
      "prompt": "Is the fallback rehearsed with an explicitly named on-call owner?"
    },
    {
      "decision_id": "decision-6-launch-editor",
      "subject_entry_id": "entry-launch",
      "reviewer_participant_id": "editor",
      "prompt": "Is the release wording ready?"
    },
    {
      "decision_id": "decision-6-launch-ops",
      "subject_entry_id": "entry-launch",
      "reviewer_participant_id": "ops",
      "prompt": "Is the pilot rollout ready?"
    }
  ],
  "decision_receipts": [],
  "recorded_at": "2026-10-10T00:00:00Z"
}

